cantino/huginn,Ruby,,15349,Create agents that monitor and act on your behalf.  Your agents are standing by!
RocketChat/Rocket.Chat,JavaScript,https://rocket.chat/,10065,Have your own Slack like online chatbuilt with Meteor.
keystonejs/keystone,JavaScript,http://www.keystonejs.com,8545,node.js cms and web app framework
wekan/wekan,JavaScript,https://wekan.io,7877,The open-source Trello-like kanban (built with Meteor)
twostairs/paperwork,PHP,http://paperwork.rocks,5513,Paperwork - OpenSource note-taking & archiving alternative to EvernoteMicrosoft OneNote & Google Keep
este/este,JavaScript,https://este.firebaseapp.com/,4216,Starter kit for universal full–fledged React apps. One stack for browsermobileserver.
Strider-CD/strider,JavaScript,http://strider-cd.github.io/,3687,Open Source Continuous Integration & Deployment Server
ankane/pghero,JavaScript,,2623,A performance dashboard for Postgres
mikesall/charted,JavaScript,http://charted.co,2612,A charting tool that produces automaticshareable charts from any data file
Reportr/dashboard,JavaScript,www.reportr.io,2456,Your life's personal dashboard.
kanboard/kanboard,PHP,https://kanboard.net,2248,Kanban project management software
necolt/Swifton,Swift,,2042,A Ruby on Rails inspired Web Framework for Swift that runs on Linux and OS X
reactGo/reactGo,JavaScript,,1860,Your One-Stop solution for a full-stack universal Redux App!
huytd/agar.io-clone,JavaScript,,1610,Agar.io clone written with Socket.IO and HTML5 canvas
CharlieHess/slack-poker-bot,JavaScript,,1454,A bot that deals Texas Hold'em games in Slack
peers/peerjs-server,JavaScript,http://peerjs.com,1420,Server for PeerJS
DemocracyOS/democracyos,JavaScript,http://democracyos.org,1351,DemocracyOS is an online space for deliberation and voting on political proposals. The software aims to stimulate better arguments and come to better rulings.
centrifugal/centrifugo,Go,,1307,Real-time messaging (Websockets or SockJS) server in Go
solidusio/solidus,Ruby,https://solidus.io/,1209,SolidusRails eCommerce System
bucketsio/buckets,CoffeeScript,https://assembly.com/buckets,1094,[DEPRECATED] Manage content better.
beeman/loopback-angular-admin,JavaScript,,1045,Quickly create admin interfaces on a Loopback 2.x API
ellisonleao/clumsy-bird,JavaScript,http://ellison.rocks/clumsy-bird/,1031,:bird: :video_game: A MelonJS port of the famous Flappy Bird Game
atmos/camo,CoffeeScript,,933,:lock: an http proxy to route images through SSL
h2non/imaginary,Go,,928,Fast HTTP microservice for high-level image processing. Perfectly fitted for Docker and Heroku.
SamyPesse/betty,JavaScript,,852,Google Voice with Receptionist abilitiesbuilt on top of Twilio
coinbase/toshi,Ruby,https://toshi.io,850,An open source Bitcoin node built to power large scale web applications.
whitef0x0/tellform,JavaScript,https://tellform.com/,836,✏️ Free Opensource Alternative to TypeForm or Google Forms
TailorDev/monod,JavaScript,https://monod.lelab.tailordev.fr/,812,:notebook: Our coolsecureand offline-first Markdown editor.
karan/slack-overflow,Python,http://so.goel.io,791,A programmer's best friendnow in Slack.
hotsh/rstat.us,Ruby,http://rstat.us/,752,Simple microblogging network based on the ostatus protocol.
outsideris/slack-invite-automation,JavaScript,,752,A tiny web application to invite a user into your slack team.
DefactoSoftware/Hours,Ruby,https://happyhours.io,740,Time registration that doesn't suck
MaxCDN/bootstrap-cdn,JavaScript,https://www.bootstrapcdn.com,727,Free Bootstrap hosting on MaxCDN's Content Delivery Network
doubleleft/hook,PHP,http://hook-platform.org/,709,A RESTful and extendable Backend as a Service that provides instant backend to develop sites and apps fasterwith dead-simple integration for JavaScriptiOSAndroid and more.
lightning-viz/lightning,JavaScript,http://lightning-viz.org,683,Data Visualization Server
CultivateLabs/storytime,Ruby,,679,Storytime is a Rails 4+ CMS and blogging enginewith a core focus on content. It is built and maintained by @cultivatelabs
vert-x3/vertx-examples,Java,,676,
hipchat/hubot-hipchat,CoffeeScript,https://www.hipchat.com/help/page/bots,671,HipChat adapter for GitHub's Hubot
mirumee/saleor,Python,http://getsaleor.com,652,An e-commerce storefront for Python and Django
tombh/peas,Ruby,,621,Docker and Ruby based PaaS
auth0/sharelock,HTML,https://sharelock.io,577,Securely share data
coderaiser/cloudcmd,JavaScript,https://cloudcmd.io,569,✨☁️📁✨ Cloud Commander is an orthodox web file manager with console and editor.
edgurgel/poxa,Elixir,http://poxa.herokuapp.com/,562,Pusher server implementation compatible with Pusher client libraries.
obfuscurity/descartes,JavaScript,,524,Introspective dashboard for Graphite
etsy/opsweekly,JavaScript,,515,On call alert classification and reporting
substrakt/letsencrypt-heroku,Ruby,https://substrakt.com/heroku-ssl-me-weve-come-a-long-way/,496,Make any Heroku application secure in just a couple of minutes.
getsentry/freight,Python,https://freight.readthedocs.io,484,Freight is a service which aims to make application deployments better.
prose/gatekeeper,JavaScript,,473,Enables client-side applications to dance OAuth with GitHub.
fastlane/boarding,Ruby,https://fastlane.tools,466,Instantly create a simple signup page for TestFlight beta testers
asapach/peerflix-server,JavaScript,,464,Streaming torrent client for node.js with web ui.
GitbookIO/nuts,JavaScript,http://nuts.gitbook.com,464,:chestnut: Releases/downloads server with auto-updater and GitHub as a backend
symfony/symfony-demo,PHP,https://symfony.com/,449,Symfony Demo Application
theiterators/akka-http-microservice,HTML,,449,Example of (micro)service written in Scala & akka-http
OmarElGabry/chat.io,JavaScript,http://chatio.herokuapp.com/,379,A Real Time Chat Application built using Node.jsExpressMongooseSocket.ioPassport& Redis.
r7kamura/ruboty,Ruby,,360,Ruby + Bot = Ruboty
OWASP/NodeGoat,HTML,https://www.owasp.org/index.php/Projects/OWASP_Node_js_Goat_Project,357,The OWASP NodeGoat project provides an environment to learn how OWASP Top 10 security risks apply to web applications developed using Node.js and how to effectively address them.
tonycoco/heroku-buildpack-ember-cli,Shell,,343,A Heroku Buildpack for Ember CLI Applications
WellCommerce/WellCommerce,HTML,http://wellcommerce.org/,340,Open-source E-Commerce software
crowi/crowi,JavaScript,http://site.crowi.wiki,331,Crowi - Wiki
dtaniwaki/rack-dev-mark,Ruby,,300,Show dev mark on development env
keen/pingpong,CSS,http://keen.github.io/pingpong/,298,HTTP monitoring for developers. Richer analyticsgreater flexibility.
panicinc/PunchClockServer,Ruby,,298,Provides a set of endpoints for the PunchClock iOS app as well as a Status Board-compatible In/Out panel.
bborn/lewsnetter,Ruby,,288,E-mail marketing application (create and send e-mail newsletter via SES). Includes subscription managementdeliverybounce and complaint notificationtemplatesand some stats.
silexlabs/Silex,JavaScript,http://www.silex.me,280,Silex is a static website builder in the cloud.
racehub/om-bootstrap,Clojure,om-bootstrap.herokuapp.com,279,Bootstrap 3 Components built with Om.
vladotesanovic/angular2-express-starter,TypeScript,https://express-angular2.herokuapp.com,265,Angular 2 and Express :family: ( Heroku ready )
EC-CUBE/ec-cube,PHP,http://www.ec-cube.net,263,EC-CUBE is the most popular e-commerce solution in Japan
Imgur/mandible,Go,,260,An all-in-one image-uploader
nightscout/cgm-remote-monitor,JavaScript,,247,nightscout web monitor
rakam-io/rakam,Java,https://rakam.io,245,An analytics platform that makes easy to create custom analytics services
mafintosh/signalhub,JavaScript,,244,Simple signalling server that can be used to coordinate handshaking with webrtc or other fun stuff.
yongjhih/docker-parse-server,JavaScript,https://hub.docker.com/r/yongjhih/parse-server/,240,Provide docker images and docker stack for parse-server npm versions and latest commit
redpen-cc/redpen,Java,http://redpen.cc,237,RedPen is an open source proofreading tool a tool to check if your technical documents meet the writing standard. RedPen supports various markup text formats (MarkdownTextileAsciiDocRe:VIEW and LaTeX).
seratch/gistub,Ruby,http://gistub.herokuapp.com/,234,Sharing code snippets in-house
openplans/shareabouts,JavaScript,,232,Shareabouts is a mapping application for crowdsourced info gathering.
stripe/gaps,Ruby,,225,Easy management of your Google Groups subscriptions.
nicolewhite/slack-meme,Python,,222,A Meme Bot for Slack.
colonizers/colonizers,CSS,http://colonizers.github.io,220,"Based on ""The Settlers of Catan"" by Klaus Teuber."
stripe-contrib/pagerbot,Ruby,https://stripe.com/blog/pagerbot,205,Manage Pagerduty on-call schedules from within your internal chat channels.
rainforestapp/fourchette,Ruby,,195,DEPRECATED - Your new best friend for isolated testing environments on Heroku.
ikawaha/kagome,Go,,192,Self-contained Japanese Morphological Analyzer written in pure golang
heroku/starboard,CSS,https://github.com/heroku/starboard,189,onboardingoffboardingor crossboarding made easy
nerdbaggy/StatusPage,JavaScript,http://projects.spencerl.com/statuspage/,189,Public Status Page for UptimeRobot
guardian/gu-who,Scala,https://gu-who.herokuapp.com/,178,answering: who are all these users in my GitHub org?
koofr/javatoscala,HTML,,169,Online Java to Scala converter
wejs/we,JavaScript,http://wejs.org/,161,Extensible Node.js MVC framework
martinmicunda/ionic-photo-gallery,JavaScript,,158,A hybrid app with authentication that allows registered users view a gallery of photos they have uploaded via the camera phone.
dickeyxxx/npm-register,JavaScript,,155,Your own private npm registry and backup server
trailofbits/tubertc,JavaScript,https://afternoon-citadel-6116.herokuapp.com/,150,Peer-to-Peer Video Chat for Corporate LANs
binaryberry/seal,Ruby,,148,This is a Slack bot that publishes a team's pull requests to their Slack Channelonce provided the organisation namethe team members' github namesand a list of repos to follow. It is my first 20% project at GDS.
JensDebergh/certificate-dashboard,JavaScript,https://certificate-check.herokuapp.com/,146,Dashboard for ssl certificates
9uuso/vertigo,Go,https://9uuso.github.io/vertigo,145,Blog engine in Go (golang)
remind101/conveyor,Go,http://engineering.remind.com/introducing-conveyor/,142,A fast build system for Docker images.
ericf/open-marriage,JavaScript,http://leslie-eric.us/,138,The open source website for Leslie Verploegen's and Eric Ferraiuolo's wedding
pglombardo/PasswordPusher,JavaScript,https://pwpush.com,137,PasswordPusher is an application to securely communicate passwords over the web.  Passwords automatically expire after a certain number of views and/or time has passed.
shaialon/ember-admin-dashboards,Handlebars,https://ember-admin-dashboards.herokuapp.com,137,An Ember-Cli Project - Starter admin template based on AdminLTE. Has an example real data dashboard using twitter stream.
tdiary/tdiary-core,Ruby,http://www.tdiary.org/,132,tDiaryThe TSUKKOMI-able Weblog.
karan/slack-news,JavaScript,http://git.io/news,124,Read news from multiple sources within Slack by just typing /news.
mattupstate/flask-social-example,Python,,122,An application that serves as a working example for Flask-Social
rubycentral/cfp-app,Ruby,,120,Rails app for managing a conference CFP
maxdemarzi/neovigator,JavaScript,https://neovigator.herokuapp.com,119,Demo visualization of Neo4j data
taironas/tinygraphs,Go,http://tinygraphs.com/,115,avatar generator web service
metasoarous/datsys,Clojure,,114,(+ clj cljs datomic datascript re-frame-esque-frp)
khaled/react-express-template,CoffeeScript,,111,Full stack web app starter template using ReactES6CoffeeScriptExpressand more
fnando/uptime_checker,Ruby,,110,Check if your sites are online for $7/mo.
kanreisa/reichat,JavaScript,https://r2.ag/reichat-preview/,110,A lovely paint chat application like a PaintChatApp built with Node.
ryanbrainard/forceworkbench,PHP,workbench.developerforce.com,107,Web-based suite of tools for administrators and developers to interact with the Force.com APIs
cgreening/simple-webpack-react-starter,JavaScript,,106,Simple webpack starter with react and express backend server
twitterdev/twitter-stream-globe,JavaScript,,102,A real-time 3D visualization of Tweets around the world. Uses three.js (WebGL)Angular & PubNub.
alainmeier/cryptonote,Ruby,https://cryptonote.me,101,:lock: A simple open source web application that lets users encrypt and share messages that can only be read once.
Japont/Japont-core,Python,https://japont.herokuapp.com/,97,Dynamic Subsetting System for CJK fonts.
bayne/symfony-angular-todomvc,JavaScript,,96,An implementation of TodoMVC using AngularJS and Symfony REST Edition
timwis/jkan,HTML,https://jkan.io,94,A lightweightbackend-free open data portalpowered by Jekyll
wearehanno/oskar,CoffeeScript,http://oskar.hanno.co,93,Oskar is a Slackbot that tracks how happy people are at work and helps remote teams to prevent isolation
heroku/mobile-template1,JavaScript,,92,
codefirst/AsakusaSatellite,Ruby,https://www.codefirst.org/AsakusaSatellite,91,a realtime chat application for developers
themarshallproject/klaxon,Ruby,https://newsklaxon.org,91,[Developer's release] Klaxon enables reporters and editors to monitor scores of sites and files on the web for newsworthy changes.
rutan/potmum,Ruby,,90,Potmum is cloud note-app.
RobSpectre/Twilio-Hackpack-for-Heroku-and-Flask,Python,http://www.twilio.com,88,The fastest way to start using Twilio with Python.
blha303/question,Python,,85,A Flask web server for quickly asking someone a question
sangria-graphql/sangria-akka-http-example,Scala,http://sangria-graphql.org,84,An example GraphQL server written with akka-http and sangria
rutan/togelack,Ruby,,83,Slackまとめ
andrewvy/slack-pongbot,JavaScript,,78,:computer: [DEPRECATED] Node.js Slack Bot for ping pong tracking.
cloudfoundry/php-buildpack,PHP,,78,A Cloud Foundry Buildpack for PHP.
codeforboston/mbta-ninja,JavaScript,http://mbta.ninja,78,MBTA Ninja!
go-cq/cq,Go,,78,neo4j cypher library for database/sql in go
mohiva/play-silhouette-seed,Scala,,78,The Silhouette Seed project is an Activator template which shows how Silhouette can be implemented in a Play Framework application.
elovation/elovation,Ruby,,77,Simple rails app to track your game results with elo and trueskill ratings
tilomitra/bedrock,JavaScript,http://tilomitra.github.io/bedrock/,77,Create a Node web app with user authenticationsecurityand more in under 10 minutes.
mohiva/play-silhouette-angular-seed,JavaScript,,76,The Silhouette Angular Seed project is an Activator template which shows how Silhouette can be used to create a SPA with AngularJS and Play.
dickeyxxx/angular-boilerplate,JavaScript,https://angular-boilerplate.herokuapp.com/,75,example angular app
dblock/slack-gamebot,Ruby,,73,Ping pongchesspool and other games bot for Slack.
thoughtpolice/heroku-ping,Ruby,,71,A utility to ping heroku web applications and keep them alive.
guardian/prout,Scala,http://www.theguardian.com/info/developer-blog/2015/feb/03/prout-is-your-pull-request-out,69,Looks after your pull requeststells you when they're live
benbalter/markdown-to-pdf,Ruby,https://github-pdf.herokuapp.com/benbalter/markdown-to-pdf/blob/master/README.pdf,68,On demand generation of enterprise-grade PDFs from GitHub-hosted markdown files
dropbox/mdwebhook,Python,https://mdwebhook.herokuapp.com,65,A sample app that uses webhooks to convert Markdown files to HTML.
heroku/java-getting-started,FreeMarker,https://devcenter.heroku.com/articles/getting-started-with-java,63,Getting Started with Java on Heroku
lukasz-madon/json-job,JavaScript,http://lukasz-madon.github.io/json-job/,63,JSON-based standard for job posts
qmachine/qmachine,JavaScript,https://www.qmachine.org,62,A platform for World Wide Computing
Tomohiro/fluentular,Ruby,http://fluentular.herokuapp.com,62,:memo: Fluentular is a Fluentd regular expression editor
codeforamerica/glossary-bot,Python,,61,A Glossary bot for Slack
esanchezm/amazon-cloudwatch-to-slack,JavaScript,,61,Relay alerts from Amazon CloudWatch to a Slack.com room.
tdtds/massr,JavaScript,,61,Mini Wassr
static-publisher/static-publisher,JavaScript,,60,Automated deployment server for static site generators
TheSharks/WildBeast,JavaScript,,60,A Discord bot made for maximum personalisation and ease of use.
blairanderson/rails-hackernews-reddit-producthunt-clone,Ruby,http://blairanderson.github.io/rails-hackernews-reddit-producthunt-clone,59,Start your own social link-sharing website. Built with ruby-on-rails.
auth0-samples/auth0-sso-dashboard,JavaScript,,57,[DEPRECATED] App Single Sign On Dashboard using Auth0
factor-io/websockethook,HTML,,57,A simple web service to receive web hooks over a web socket.
heroku/windmill,Ruby,,57,A TLS endpoint for serving osquery configuration
chesleybrown/bitbucket-codeship-status,JavaScript,,56,Small app that will automatically update newly created pull requests in Bitbucket with the branch's Codeship build status.
ionicthemes/building-a-complete-mobile-app-with-ionic-framework,JavaScript,https://jsconfuy2015.herokuapp.com,56,JSConfUY 2015 Ionic workshop app
bishopZ/kabuki-motion,JavaScript,,54,a React.js Boilerplate for Web Animators
bjeanes/grabshot,Ruby,http://grabshot.herokuapp.com/,53,Mini API to create screenshots of websites and call back with the image data.
pudo/storyweb,CSS,http://demo.storyweb.grano.cc/,53,A contextual news development environment.
bborn/opensauna,JavaScript,http://bborn.github.io/opensauna/,52,Sauna - a social news reader and curation tool
dzuelke/heroku-multipack-nodejs-php-example,PHP,http://heroku-multipack-nodejs-php-ex.herokuapp.com,51,A sample application for Herokushowing how heroku/heroku-buildpack-multi can be used to combine Node.js and PHPusing Bower in a Composer post-install-cmd to install bootstrap.
lfilho/bitbucket-slack-pr-hook,JavaScript,,51,Receive Pull Requests notifications from BitBucket and send them to Slack.
sethherr/grape-doorkeeper,Ruby,https://grape-doorkeeper.herokuapp.com,51,Get to API building quickly
efcl/efcl.github.io,HTML,http://efcl.info/,50,Web Scratchブログのリポジトリ
jwhitlock/drf-cached-instances,Python,,50,Cached instances for Django REST Framework
sematext/logagent-js,JavaScript,http://sematext.com/logsene,50,Smart Log Parser and Log Shipper written in Node
upnext/BeaconControl,Ruby,https://beaconcontrol.io,50,Setup and manage large beacon deployments  with BeaconControl open source platform
Kaixhin/FGLab,HTML,https://kaixhin.github.io/FGLab/,49,Future Gadget Laboratory
newspipe/newspipe,Python,https://www.newspipe.org,48,The official @github repository of the Newspipe software. A web news aggregator and reader.
aaronbassett/Bad-Tools,Python,http://www.codingexcuses.com/,47,Excuses for bad programmers.
aaronlerch/respond-to-it,JavaScript,http://httpresponder.com/,47,Debug and respond to web hooks like a pro.
liquidz/jubot,Clojure,,47,Chatbot framework in Clojure
enterlab/rente,Clojure,http://enterlab.com,46,Rente: ClojureClojureScriptReagent (react) + Sente (web sockets). Heroku-ready!
GetStream/django_twitter,Python,https://getstream.io,46,An example app built using getstream.io
Iragne/PCDN,JavaScript,http://pcdn.jairagne.ovh,46,PCDN is an Peer to peer CDN for videoit's Hybrid CDN/P2P Architecture. HTTP Live StreamingWebRTCvideojs and peerjsHLS and Video for broadcasts
lankz/gunzel,Ruby,,46,Slices through the setup time for your next Rails project
mohnish/money,Ruby,http://moneyapp.me/signup,46,Money (beta) - let's you manage your money and visualize where your money goes. Built using Ruby 2.3.0Rails 4.2.5Backbone and Bootstrap
heroku/lumbermill,Go,,43,DEPRECATED: Log Processor. See https://engineering.heroku.com/blogs/2016-05-26-heroku-metrics-there-and-back-again/ for more information.
immutant/feature-demo,Clojure,,42,Trivial examples of all the Immutant features
dwarvesf/working-on,Go,,41,Working On is a simple tool that integrated with Slackhelp the team improve teamwork spirit and productivity also
pythonindia/wye,HTML,https://pythonexpress.in/,41,Wye is a workshop collaboration software
gozman/slack-rss,JavaScript,,39,Create an RSS feed from links in your Slack channels
Sparragus/imma-let-you-finish,JavaScript,http://ledhack.org/imma-let-you-finish/,39,imma-let-you-finish celebrates over five years of Kanye West hacking the stage. This Slack Bot will randomly appear on your conversation to tell everyone who has the best comment of all times. Of all times!
csm123/RSStoAPI,Ruby,,38,An API for retrieving and serving RSS feedswith caching
kentaro/takosan,Go,,38,A Simple Web Interface to Slack (Ikachan for Slack)
mccxiv/torrent-web,JavaScript,,38,Stream and download torrents directly over http with a web UI
ncarlier/nunux-reader,HTML,http://reader.nunux.org/,38,The super-fast-minimalist-nosql-opensource Google Reader revival.
sbrunk/play-silhouette-slick-seed,Scala,,38,The Silhouette Slick Seed project is an Activator template which shows how Silhouette can be implemented in a Play Framework application. It can use the play-slick plugin for db access.
TwidereProject/Twidere-API-Proxy-Go,Go,,38,
aces/Loris,PHP,,37,LORIS is a web-accessible database solution for longitudinal multi-site studies.
honeybadger-io/honeybadger-elixir,Elixir,,37,Elixir client for Honeybadger.
alphagov/spotlight,JavaScript,,36,Hybrid rendering application for the Performance Platform using Backbone and D3
karan/slack-hn,JavaScript,https://github.com/karan/slack-news,36,SEE https://github.com/karan/slack-news INSTEAD
seapy/slack_invite_automation_sinatra,HTML,,36,Slack invite automation using sinatra
springernature/bandiera,Ruby,,35,Simple Feature Flagging
joshdholtz/jenkins-slack-command,Ruby,,34,Start a build in Jenkins using a Slack Command
jpmckinney/image-proxy,JavaScript,,34,An image proxy using the Express Node.js framework
tsujio/webrtc-bbs,JavaScript,,34,A distributed anonymous BBS over P2P overlay using WebRTC
alerta/angular-alerta-webui,HTML,http://try.alerta.io,32,Alerta Web UI 3.0
codefirst/keima,JavaScript,https://keima.herokuapp.com/,32,A simpleopenrealtime notification service
ryanbrainard/axiom,Java,https://axiomsso.herokuapp.com,32,Tools for learningtestingand troubleshooting single sign-on solutions for Salesforce.com
webpay/sslack,Shell,,32,Search Slack by ElasticSearch
GetStream/Stream-Example-Nodejs,JavaScript,https://getstream.io,31,An example app built using getstream.io
heroku/busl,Go,,31,a simple pubsub service that runs on Heroku
twschiller/open-synthesis,Python,https://www.opensynthesis.org,31,Open platform for CIA-style intelligence analysis
benbalter/problem_child,Ruby,,30,Allows authenticated or anonymous users to fill out a standard web form to create GitHub issues (and pull requests).
rogeriochaves/structured-elm-todomvc,Elm,,30,Structured TodoMVC with Elm to exemplify real-world apps
apiaryio/polls-api,Python,,29,Polls is an example web API that allows consumers to view polls and vote in them.
jmeas/moolah,JavaScript,,29,Track your finances (work in progress)
city72/city-72,JavaScript,http://toolkit.sf72.org,28,This is the open source code of the City72 platform. Fork this codethen deploy your own City72 site.
dzucconi/emojify,Ruby,,28,A communication tool
koba04/react-server-side-rendering-sample,JavaScript,http://react-ssr-sample.herokuapp.com/,28,for React.js AdventCalendar 2014
monty5811/apostello,Python,https://church.io/apostello/,28,sms for your church
netguru/props,Ruby,https://netguru.co/opensource,27,PropsApp: say thank you in a geeky way!
vladotesanovic/angular2-express-slim,JavaScript,,27,Quickstart Angular 2 app on Express
britter/spring-boot-heroku-demo,Java,http://spring-boot-heroku-demo.herokuapp.com,26,Demo project showing how to deploy a Spring Boot application to Heroku
dulaccc/Accountant,HTML,http://accountant-x.herokuapp.com/,26,Accounting made accessible for small businesses and sole proprietorships through a simple Django project.
stripe/example-ios-backend,Ruby,,26,A simpleeasy-to-deploy backend that you can use to demo our example iOS apps.
destruc7i0n/shulker,JavaScript,,25,A Discord to Minecraft Chat Gateway
ellisonleao/slack-howdoi,HTML,,25,:cloud: Slack integration with the howdoi library
macobo/slackbot,Ruby,,25,Create your own slack or irc bot
newrelic/newrelic-ruby-kata,Ruby,http://newrelic-ruby-kata.herokuapp.com,25,
RocketChat/Rocket.Chat.Docs,Ruby,https://rocket.chat/docs,25,Source for the documentation website
vicky002/slack-TheL,Python,,25,The Genious Lnow in slack to answer all your Queries! :sunglasses:
bmpvieira/simple-corsproxy,JavaScript,,24,Proxy to access resources that lack the Access-Control-Allow-Origin * header
mkbehbehani/play-heroku-seed,Scala,,24,Seed app for PlayHeroku and Postgres with demo CRUD modelviewcontroller
pedrorijo91/slack-pr-bot,Scala,,24,Slack bot that regularly reminds team members to review pending pull requests
scholarslab/prism,Ruby,http://prism.scholarslab.org/,24,Prism is a tool for collective interpretation. It's an ongoing experiment by the Praxis Program at the University of Virginia Scholars' Lab
amitdev/simple-rest-scala,Scala,http://www.typesafe.com/activator/template/simple-rest-scala,23,
dan/topicbot,Ruby,http://topics.5by5.tv,23,A topic suggestion app in Railsfor podcasters.
Detry322/redisred,JavaScript,http://jack.plus/redisred,23,A small Redis-based URL Redirector
jaesivsm/JARR,Python,https://jarr.info,23,JARR is a web news aggregator.
lukasz-madon/hackers-job-apply,Python,,23,Reduce the spam you get for your job posting by setting up a micro challenge.
obfuscurity/judy,Ruby,http://obfuscurity.github.io/judy,23,Bespoke service for reviewing CFP submissions
